{"schema_version":1,"plan_id":"live-applier-001","project_change_count_before":20,"project_change_count_after":21,"items":[{"id":"color-drums","verb":"set_track_color","status":"applied"},{"id":"rename-marker-1","verb":"rename_marker","status":"applied"},{"id":"rename-region-202","verb":"rename_region","status":"applied"},{"id":"delete-marker-2","verb":"delete_marker","status":"applied"}]}
